{
  "$id": "https://drasi.io/schemas/workgraph/workgraph.execution-v1.json",
  "$schema": "https://json-schema.org/draft/2020-12/schema",
  "additionalProperties": false,
  "description": "The single, pure-JSON issue comment the reaction posts immediately after a task is confirmed created (HTTP 201). Mirrors WorkGraphExecutionCommentV1 in src/prompt.rs — keep in sync.",
  "properties": {
    "actualModel": {
      "type": "string"
    },
    "agentProfile": {
      "type": "string"
    },
    "executionId": {
      "type": "string"
    },
    "expectedEventId": {
      "type": "string"
    },
    "messageType": {
      "const": "execution"
    },
    "profileRef": {
      "type": "string"
    },
    "requestedModel": {
      "type": "string"
    },
    "requiredEventType": {
      "const": "CompletedIssueValidation"
    },
    "responsibilityId": {
      "type": "string"
    },
    "routeId": {
      "type": "string"
    },
    "schemaVersion": {
      "const": "workgraph.execution/v1"
    },
    "startedAt": {
      "format": "date-time",
      "type": "string"
    },
    "state": {
      "const": "started"
    },
    "taskId": {
      "type": "string"
    },
    "taskUrl": {
      "type": "string"
    }
  },
  "required": [
    "schemaVersion",
    "messageType",
    "routeId",
    "responsibilityId",
    "executionId",
    "expectedEventId",
    "requiredEventType",
    "taskId",
    "taskUrl",
    "agentProfile",
    "profileRef",
    "requestedModel",
    "actualModel",
    "state",
    "startedAt"
  ],
  "title": "workgraph.execution/v1",
  "type": "object"
}
