{
  "schemaVersion": "workgraph.execution/v1",
  "messageType": "execution",
  "routeId": "validation:PVTI_workgraph_fixture_item:2026-08-13T18:59:00.000Z",
  "responsibilityId": "validation:PVTI_workgraph_fixture_item:2026-08-13T18:59:00.000Z:issue-validator",
  "executionId": "execution:fixture-validation-1",
  "expectedEventId": "event:execution:fixture-validation-1:CompletedIssueValidation",
  "requiredEventType": "CompletedIssueValidation",
  "taskId": "AT_fixture_validation_1",
  "taskUrl": "https://github.com/drasi-project/drasi-workgraph-demo/agents/tasks/AT_fixture_validation_1",
  "agentProfile": "issue-validator",
  "profileRef": "issue-validator@0123456789abcdef0123456789abcdef01234567",
  "requestedModel": "gpt-5.6-sol",
  "actualModel": "gpt-5.4",
  "state": "started",
  "startedAt": "2026-08-13T19:00:05Z"
}
